{
  "person": {
    "name": "Alex Developer",
    "location": "Spain | Remote / hybrid",
    "email": "alex@example.com",
    "phone": "+34 600 000 000",
    "availability": "Available for remote and hybrid Android roles."
  },
  "target": {
    "title": "Android Developer | Kotlin | Jetpack Compose",
    "roleLabel": "Android / Kotlin"
  },
  "profile": [
    "Android Developer with practical experience building and maintaining mobile applications with Kotlin and Java, focused on code quality, clean architecture, and continuous improvement.",
    "Experienced with Android SDK, Jetpack Compose, Jetpack Components, MVVM, Clean Architecture, REST API consumption, debugging, Git, Gradle, CI/CD, and agile collaboration."
  ],
  "skills": [
    {
      "name": "Android",
      "items": ["Kotlin", "Java", "Android SDK", "Jetpack Compose", "Lifecycle", "ViewModel", "Navigation", "Room", "Retrofit", "Firebase", "Material Design"]
    },
    {
      "name": "Architecture",
      "items": ["Clean Architecture", "MVVM", "MVI", "SOLID", "modularization", "refactoring"]
    },
    {
      "name": "Quality",
      "items": ["JUnit", "Mockito", "Espresso", "Compose UI tests", "Turbine", "Crashlytics", "debugging"]
    },
    {
      "name": "Tools",
      "items": ["Git", "GitHub Actions", "Gradle", "Android Studio", "Scrum", "Jira"]
    }
  ],
  "experiencePrimary": [
    {
      "company": "Retail App Company",
      "role": "Android Developer",
      "dates": "Jan 2023 - Present",
      "stack": "Kotlin, Java, Android SDK, Jetpack Compose, Gradle, GitHub Actions",
      "highlights": [
        "Develop and maintain Android features for a customer-facing retail application.",
        "Implement modern UI screens with Kotlin and Jetpack Compose.",
        "Fix bugs, improve stability, and contribute to refactoring efforts.",
        "Collaborate with product, QA, backend, and design teams in Scrum."
      ]
    }
  ],
  "experienceSecondary": [],
  "education": [
    {
      "name": "Technical Degree / Computer Science Training",
      "detail": "Year - Year | Graduate"
    }
  ],
  "training": [
    "Android Kotlin Jetpack Compose.",
    "Clean Architecture for Android.",
    "CI/CD foundations."
  ],
  "alignment": ["Kotlin", "Android SDK", "Jetpack Compose", "MVVM", "Clean Architecture", "SOLID", "testing", "CI/CD", "Scrum"]
}
